<?xml version="1.0"?>
<!--
To change this license header, choose License Headers in Project Properties.
To change this template file, choose Tools | Templates
and open the template in the editor.
-->

<xs:schema version="1.0"
           xmlns:xs="http://www.w3.org/2001/XMLSchema"
           elementFormDefault="qualified">

    <xs:element name="Biblioteca">
        <xs:complexType>
            <xs:sequence>
                <xs:element name="libros" >
                    <xs:complexType>
                        <xs:sequence>
                            <xs:element name="libro"  maxOccurs="unbounded" >
                                <xs:complexType>
                                    <xs:sequence>
                                        <xs:element name="isbn" type="xs:String"/>
                                        <xs:element name="titulo" type="xs:String"/>
                                        <xs:element name="autor"  type="xs:String"/>
                                        <xs:element name="numeroPgs"  type="xs:integer"/>
                                        <xs:element name="prestado"  type="xs:Boolean"/>
                                    </xs:sequence>
                                </xs:complexType>
                            </xs:element>
                        </xs:sequence>
                    </xs:complexType>
                </xs:element>
                <xs:element name="Usuarios" >
                    <xs:complexType>
                        <xs:sequence>
                            <xs:element name="Usuario" >
                                <xs:complexType>
                                    <xs:sequence>
                                        <xs:element name="Usuario"  maxOccurs="unbounded">
                                            <xs:complexType>
                                                <xs:sequence>
                                                    <xs:element name="Nombre" type="xs:String"/>
                                                    <xs:element name="ArrayLibros"  maxOccurs="3">
                                                        <xs:complexType>
                                                            <xs:sequence>
                                                                <xs:element name="isbn" type="xs:String"/>
                                                                <xs:element name="titulo" type="xs:String"/>
                                                                <xs:element name="autor"  type="xs:String"/>
                                                                <xs:element name="numeroPgs"  type="xs:integer"/>
                                                                <xs:element name="prestado"  type="xs:Boolean"/>
                                                            </xs:sequence>
                                                        </xs:complexType>
                                                    </xs:element>
                                                </xs:sequence>
                                            </xs:complexType>
                                        </xs:element>
                                    </xs:sequence>
                                </xs:complexType>
                            </xs:element>
                        </xs:sequence>
                    </xs:complexType>
                </xs:element>
            </xs:sequence>
        </xs:complexType>
    </xs:element>
</xs:schema>
