<?xml version="1.0" encoding="UTF-8"?>
<!--
To change this license header, choose License Headers in Project Properties.
To change this template file, choose Tools | Templates
and open the template in the editor.
-->


<Biblioteca
    xmlns:xsi='http://www.w3.org/2001/XMLSchema-instance'
    xsi:noNamespaceSchemaLocation='file:/home/daw/NetBeansProjects/Programaci-n/HTMLXML/public_html/XML/Biblioteca.xsd'>
    <libros>
        <libro>
            <isbn>isbnsgt6</isbn>
            <titulo>El jardín de las palabras</titulo>
            <autor>Carlos</autor>
            <numeroPgs>325</numeroPgs>
            <prestado>true</prestado>
        </libro>
    </libros>
    <Usuarios>
        <Usuario>
            <Usuario>
                <Nombre> Juanma </Nombre>
                <ArrayLibros>
                    <isbn>isbnsgt6</isbn>
                    <titulo>El jardín de las palabras</titulo>
                    <autor>Carlos</autor>
                    <numeroPgs>325</numeroPgs>
                    <prestado>true</prestado>
                </ArrayLibros>
            </Usuario>
        </Usuario>
    </Usuarios>

</Biblioteca>
